{
  "portUnit": "EXT-DOC-001",
  "managedPaths": [
    "src/CollisionDocNet.Conversion",
    "src/CollisionDocNet.Storage",
    "src/CollisionDocNet.Writer"
  ],
  "upstreamInputs": [],
  "specificationInputs": [
    {
      "name": "MS-DOC 12.5 release DOCX",
      "url": "https://officeprotocoldocs-f5hpbjgea6b8gneq.b02.azurefd.net/files/MS-DOC/%5bMS-DOC%5d-260217.docx",
      "revisionOrDate": "12.5 / 2026-02-17",
      "sha256": "2e48b21886ebdd5dcc281c3d9baf1b7841c9f3d6881a153862069bbbc0608d7a"
    },
    {
      "name": "MS-CFB 12.0 release DOCX",
      "url": "https://winprotocoldocs-bhdugrdyduf5h2e4.b02.azurefd.net/MS-CFB/%5bMS-CFB%5d-240423.docx",
      "revisionOrDate": "12.0 / 2024-04-23",
      "sha256": "2d650184072a148ba98ad0b68072fd5ad7780e46f3528d7f263f3127b2dadab5"
    },
    {
      "name": "MS-ODRAW 12.4 release DOCX",
      "url": "https://officeprotocoldocs-f5hpbjgea6b8gneq.b02.azurefd.net/files/MS-ODRAW/%5bMS-ODRAW%5d-250819.docx",
      "revisionOrDate": "12.4 / 2025-08-19",
      "sha256": "9ead8f1f3805cf6d4f5597bed516bf7604e330b803f64d28d9b7a0a9dba9a2fc"
    },
    {
      "name": "MS-OLEDS 13.0 release DOCX",
      "url": "https://winprotocoldocs-bhdugrdyduf5h2e4.b02.azurefd.net/MS-OLEDS/%5bMS-OLEDS%5d-240423.docx",
      "revisionOrDate": "13.0 / 2024-04-23",
      "sha256": "42e666e9f1b1c437972bbe601d302ec25e45557eb309c7d854e54facfeddb134"
    },
    {
      "name": "MS-OLEPS 9.0 release DOCX",
      "url": "https://winprotocoldocs-bhdugrdyduf5h2e4.b02.azurefd.net/MS-OLEPS/%5bMS-OLEPS%5d-240423.docx",
      "revisionOrDate": "9.0 / 2024-04-23",
      "sha256": "4343243993cd16bda98e5abe5383a82db5f2eea0b34b54dc7d93978a372844ea"
    },
    {
      "name": "MS-OSHARED 11.1 release DOCX",
      "url": "https://officeprotocoldocs-f5hpbjgea6b8gneq.b02.azurefd.net/files/MS-OSHARED/%5bMS-OSHARED%5d-251113.docx",
      "revisionOrDate": "11.1 / 2025-11-13",
      "sha256": "3a17ec72868a7ba8c9c987995c8902e832a42d66eecbf149101a4e6c7255f87c"
    },
    {
      "name": "MS-OFFCRYPTO 14.0 release DOCX",
      "url": "https://officeprotocoldocs-f5hpbjgea6b8gneq.b02.azurefd.net/files/MS-OFFCRYPTO/%5bMS-OFFCRYPTO%5d-260217.docx",
      "revisionOrDate": "14.0 / 2026-02-17",
      "sha256": "9b7a67eb5d0408566a61f218792fcd21536dbc970d83695ad94365e535533f33"
    },
    {
      "name": "MS-OVBA 15.0 release DOCX",
      "url": "https://officeprotocoldocs-f5hpbjgea6b8gneq.b02.azurefd.net/files/MS-OVBA/%5bMS-OVBA%5d-260519.docx",
      "revisionOrDate": "15.0 / 2026-05-19",
      "sha256": "31fb68ac3ef209cb32247a3060ff775cc0517c4120137cb39945690448b46c79"
    },
    {
      "name": "MS-OFORMS 9.1 release DOCX",
      "url": "https://officeprotocoldocs-f5hpbjgea6b8gneq.b02.azurefd.net/files/MS-OFORMS/%5bMS-OFORMS%5d-250819.docx",
      "revisionOrDate": "9.1 / 2025-08-19",
      "sha256": "7bbbbdc43407524fe2af99c070dfc358cc67404e5224b56d5cdabbc4736c9158"
    },
    {
      "name": "MS-DOC 12.5 current PDF retained copy",
      "url": "https://officeprotocoldocs-f5hpbjgea6b8gneq.b02.azurefd.net/files/MS-DOC/%5bMS-DOC%5d.pdf",
      "revisionOrDate": "retrieved 2026-07-24; paired with 12.5 / 2026-02-17",
      "sha256": "23fd1a8413ff8fa2902097060ae7dea031fca9a7979ca20633c141a756ddb27c"
    },
    {
      "name": "MS-CFB 12.0 current PDF retained copy",
      "url": "https://winprotocoldocs-bhdugrdyduf5h2e4.b02.azurefd.net/MS-CFB/%5bMS-CFB%5d.pdf",
      "revisionOrDate": "retrieved 2026-07-24; paired with 12.0 / 2024-04-23",
      "sha256": "9d0d61e34495347ee32f3de5b06f2d59953cc60607ea72605d4162d21a34863f"
    },
    {
      "name": "MS-ODRAW 12.4 current PDF retained copy",
      "url": "https://officeprotocoldocs-f5hpbjgea6b8gneq.b02.azurefd.net/files/MS-ODRAW/%5bMS-ODRAW%5d.pdf",
      "revisionOrDate": "retrieved 2026-07-24; paired with 12.4 / 2025-08-19",
      "sha256": "fbc67309646b0b95e87f66eb7a3d89c6f08153c46379f496b886a8deae42d7e5"
    },
    {
      "name": "MS-OLEDS 13.0 current PDF retained copy",
      "url": "https://winprotocoldocs-bhdugrdyduf5h2e4.b02.azurefd.net/MS-OLEDS/%5bMS-OLEDS%5d.pdf",
      "revisionOrDate": "retrieved 2026-07-24; paired with 13.0 / 2024-04-23",
      "sha256": "0ca6d5aa542092662d021748e2cc1c6ff45ffeaaecd5f5990c33258d078a9ec8"
    },
    {
      "name": "MS-OLEPS 9.0 current PDF retained copy",
      "url": "https://winprotocoldocs-bhdugrdyduf5h2e4.b02.azurefd.net/MS-OLEPS/%5bMS-OLEPS%5d.pdf",
      "revisionOrDate": "retrieved 2026-07-24; paired with 9.0 / 2024-04-23",
      "sha256": "b6a19bdeb43a498bf7499b9c8a6a06f91b57ce159f6c20bd1bf157ad3a54fa2a"
    },
    {
      "name": "MS-OSHARED 11.1 current PDF retained copy",
      "url": "https://officeprotocoldocs-f5hpbjgea6b8gneq.b02.azurefd.net/files/MS-OSHARED/%5bMS-OSHARED%5d.pdf",
      "revisionOrDate": "retrieved 2026-07-24; paired with 11.1 / 2025-11-13",
      "sha256": "fb371245d7a6e217c2c02bf9d0736f7282fafe9242fb8fc96d009294beed2725"
    },
    {
      "name": "MS-OFFCRYPTO 14.0 current PDF retained copy",
      "url": "https://officeprotocoldocs-f5hpbjgea6b8gneq.b02.azurefd.net/files/MS-OFFCRYPTO/%5bMS-OFFCRYPTO%5d.pdf",
      "revisionOrDate": "retrieved 2026-07-24; paired with 14.0 / 2026-02-17",
      "sha256": "65a20fdaef2b24cabd0c783620a46d339a98b33effffa9ca6da7795e9635ddf0"
    },
    {
      "name": "MS-OVBA 15.0 current PDF retained copy",
      "url": "https://officeprotocoldocs-f5hpbjgea6b8gneq.b02.azurefd.net/files/MS-OVBA/%5bMS-OVBA%5d.pdf",
      "revisionOrDate": "retrieved 2026-07-24; paired with 15.0 / 2026-05-19",
      "sha256": "6ca91a091da9b7a550e52ea60808fc78b676a3e96101a80990f75911619768c3"
    },
    {
      "name": "MS-OFORMS 9.1 current PDF retained copy",
      "url": "https://officeprotocoldocs-f5hpbjgea6b8gneq.b02.azurefd.net/files/MS-OFORMS/%5bMS-OFORMS%5d.pdf",
      "revisionOrDate": "retrieved 2026-07-24; paired with 9.1 / 2025-08-19",
      "sha256": "37e72c8605244ebd28c2f247f9605d858fb44c194f835867d8b9ecedcb744db4"
    }
  ],
  "implementationDecision": "specification-led",
  "licenceReviewStatus": "open",
  "internalImplementationApprovalStatus": "approved",
  "releaseLicenceReviewStatus": "open",
  "approvalBasis": "Direct repository-owner instruction on 2026-07-24 to proceed sequentially from DOC-R00 through DOC-I13.",
  "notes": "Approved by repository-owner direction on 2026-07-24 for specification-led internal research, implementation and owned testing only. Full publications remain ignored research inputs and no upstream implementation source is authorised. This limited approval does not approve specification redistribution, generated normative-table publication, product licensing or product distribution; see docs/licensing/doc-source-rights.md and ADR-0005.",
  "reviewer": "Repository owner direction recorded in task conversation",
  "reviewedAtUtc": "2026-07-24T10:36:55.7995639Z"
}
